{
  "symbol": "EXAMPLE",
  "name": "Example Fictional Ltd (format demo; not a real company)",
  "model_type": "example",
  "sector": "default",
  "statement_type": "consolidated",
  "is_example": true,
  "verified": {
    "by": "hand calculation",
    "on": "2026-09-29",
    "sources": [
      "backend/tests/fundamentals_fixture.py"
    ],
    "notes": "Expected values are the hand calculations in test_fundamentals.py."
  },
  "inputs": {
    "annual": [
      {
        "period_end": "2019-03-31",
        "fiscal_year": 2019,
        "revenue": 1000.0,
        "cogs": 500.0,
        "ebitda": 200.0,
        "other_income": 10.0,
        "depreciation": 50.0,
        "ebit": 160.0,
        "interest": 10.0,
        "pbt": 150.0,
        "tax": 45.0,
        "pat": 105.0,
        "eps_diluted": 10.5,
        "shares_diluted_cr": 10.0,
        "sga": 100.0,
        "total_assets": 1000.0,
        "current_assets": 400.0,
        "current_liabilities": 200.0,
        "total_equity": 600.0,
        "retained_earnings": 500.0,
        "total_debt": 100.0,
        "cash_and_equivalents": 50.0,
        "non_operating_investments": 50.0,
        "receivables": 100.0,
        "inventory": 60.0,
        "payables": 50.0,
        "net_block": 400.0,
        "cfo": 160.0,
        "purchase_of_fixed_assets": 80.0,
        "sale_of_fixed_assets": 0.0
      },
      {
        "period_end": "2020-03-31",
        "fiscal_year": 2020,
        "revenue": 1000.0,
        "cogs": 500.0,
        "ebitda": 200.0,
        "other_income": 10.0,
        "depreciation": 50.0,
        "ebit": 160.0,
        "interest": 10.0,
        "pbt": 150.0,
        "tax": 45.0,
        "pat": 105.0,
        "eps_diluted": 10.5,
        "shares_diluted_cr": 10.0,
        "sga": 100.0,
        "total_assets": 1000.0,
        "current_assets": 400.0,
        "current_liabilities": 200.0,
        "total_equity": 600.0,
        "retained_earnings": 500.0,
        "total_debt": 100.0,
        "cash_and_equivalents": 50.0,
        "non_operating_investments": 50.0,
        "receivables": 100.0,
        "inventory": 60.0,
        "payables": 50.0,
        "net_block": 400.0,
        "cfo": 160.0,
        "purchase_of_fixed_assets": 80.0,
        "sale_of_fixed_assets": 0.0
      },
      {
        "period_end": "2021-03-31",
        "fiscal_year": 2021,
        "revenue": 1000.0,
        "cogs": 500.0,
        "ebitda": 200.0,
        "other_income": 10.0,
        "depreciation": 50.0,
        "ebit": 160.0,
        "interest": 10.0,
        "pbt": 150.0,
        "tax": 45.0,
        "pat": 105.0,
        "eps_diluted": 10.5,
        "shares_diluted_cr": 10.0,
        "sga": 100.0,
        "total_assets": 1000.0,
        "current_assets": 400.0,
        "current_liabilities": 200.0,
        "total_equity": 600.0,
        "retained_earnings": 500.0,
        "total_debt": 100.0,
        "cash_and_equivalents": 50.0,
        "non_operating_investments": 50.0,
        "receivables": 100.0,
        "inventory": 60.0,
        "payables": 50.0,
        "net_block": 400.0,
        "cfo": 160.0,
        "purchase_of_fixed_assets": 80.0,
        "sale_of_fixed_assets": 0.0
      },
      {
        "period_end": "2022-03-31",
        "fiscal_year": 2022,
        "revenue": 1000.0,
        "cogs": 500.0,
        "ebitda": 200.0,
        "other_income": 10.0,
        "depreciation": 50.0,
        "ebit": 160.0,
        "interest": 10.0,
        "pbt": 150.0,
        "tax": 45.0,
        "pat": 105.0,
        "eps_diluted": 10.5,
        "shares_diluted_cr": 10.0,
        "sga": 100.0,
        "total_assets": 1000.0,
        "current_assets": 400.0,
        "current_liabilities": 200.0,
        "total_equity": 600.0,
        "retained_earnings": 500.0,
        "total_debt": 100.0,
        "cash_and_equivalents": 50.0,
        "non_operating_investments": 50.0,
        "receivables": 100.0,
        "inventory": 60.0,
        "payables": 50.0,
        "net_block": 400.0,
        "cfo": 160.0,
        "purchase_of_fixed_assets": 80.0,
        "sale_of_fixed_assets": 0.0
      },
      {
        "period_end": "2023-03-31",
        "fiscal_year": 2023,
        "revenue": 1000.0,
        "cogs": 500.0,
        "ebitda": 200.0,
        "other_income": 10.0,
        "depreciation": 50.0,
        "ebit": 160.0,
        "interest": 10.0,
        "pbt": 150.0,
        "tax": 45.0,
        "pat": 105.0,
        "eps_diluted": 10.5,
        "shares_diluted_cr": 10.0,
        "sga": 100.0,
        "total_assets": 1000.0,
        "current_assets": 400.0,
        "current_liabilities": 200.0,
        "total_equity": 600.0,
        "retained_earnings": 500.0,
        "total_debt": 100.0,
        "cash_and_equivalents": 50.0,
        "non_operating_investments": 50.0,
        "receivables": 100.0,
        "inventory": 60.0,
        "payables": 50.0,
        "net_block": 400.0,
        "cfo": 160.0,
        "purchase_of_fixed_assets": 80.0,
        "sale_of_fixed_assets": 0.0
      },
      {
        "period_end": "2024-03-31",
        "fiscal_year": 2024,
        "revenue": 1500.0,
        "cogs": 730.0,
        "ebitda": 330.0,
        "other_income": 20.0,
        "depreciation": 80.0,
        "ebit": 270.0,
        "interest": 10.0,
        "pbt": 260.0,
        "tax": 78.0,
        "pat": 182.0,
        "eps_diluted": 17.5,
        "shares_diluted_cr": 10.5,
        "sga": 140.0,
        "total_assets": 1200.0,
        "current_assets": 500.0,
        "current_liabilities": 200.0,
        "total_equity": 700.0,
        "retained_earnings": 600.0,
        "total_debt": 100.0,
        "cash_and_equivalents": 60.0,
        "non_operating_investments": 40.0,
        "receivables": 150.0,
        "inventory": 100.0,
        "payables": 73.0,
        "net_block": 500.0,
        "cfo": 264.0,
        "purchase_of_fixed_assets": 120.0,
        "sale_of_fixed_assets": 20.0
      }
    ]
  },
  "expected": {
    "as_of_fiscal_year": 2024,
    "metrics": {
      "roce_5y_avg": 0.22,
      "cfo_to_ebitda_5y": 0.8,
      "ccc_days": 50.0,
      "debt_to_equity": 0.142857,
      "roce_latest": 0.3,
      "opm_latest": 0.22,
      "sales_cagr_5y": 0.084472
    },
    "forensic": {
      "piotroski": 8,
      "beneish_m": -2.3687,
      "altman_z2": 6.252
    },
    "valuation": {
      "dcf": {
        "inputs": {
          "revenue": 1000.0,
          "ebit_margin": 0.2,
          "tax_rate": 0.25,
          "da_pct": 0.05,
          "capex_pct": 0.05,
          "nwc_pct": 0.0,
          "g1": 0.1,
          "g_terminal": 0.05,
          "wacc": 0.12,
          "net_debt": 100.0,
          "minority_interest": 0.0,
          "non_op_investments": 50.0,
          "shares_cr": 10.0
        },
        "value_per_share": 290.6735
      }
    }
  }
}
